filename	tags	description
image65.png	рутина, будильник, работа, усталость, день_сурка	От кровати к ноутбуку, часы, книги
image66.png	возражения, барьеры, не_справлюсь, дорого, нет_времени, муж_против	Девушка с облаками возражений
image67.png	замкнутый_круг, симптомы, проблемы, повторение	Девушка в круге симптомов, стрелки по кругу
image68.jpg	книги, обучение, знания, много_книг, радость	Девушка рядом с высокой стопкой книг, улыбается
image69.png	точка_А, точка_Б, трансформация, путь, движение	Идёт от точки А к точке Б
image70.png	спокойствие, умиротворение, покой, дзен, гармония	Девушка со сложенными руками, закрытые глаза
image71.png	симптомы, причина, корень_проблемы, анализ	Симптомы вокруг, одно облако "Причина"
image72.png	вопрос, сомнение, думает, неуверенность	Рука у подбородка, вопросительный знак
image73.png	учёба, непонимание, вопросы, стресс, за_партой	За столом с тетрадью, много вопросов
image75.png	подарок, радость, распаковка, сюрприз, бонус	Открывает подарочную коробку с бантом
image76.png	профессии, директор, психолог, учитель, карьера	Три профессии: директор, психолог, учитель
image77.png	профессии, айтишник, нумеролог, парикмахер, карьера	Три профессии: айтишник, нумеролог, парикмахер
image78.png	профессии, айтишник, госслужащая, спортсменка, карьера	Три профессии: айтишник, госслужащая, спортсменка
image79.png	тетрадь, ручка, запись, практика, обучение	Ручка пишет в тетради
image80.png	за_партой, пишет, обучение, прилежность, ученица	Ученица за столом пишет
image81.png	спикер, учитель, доска, объяснение, презентация	Сидит на коробке, показывает на доску
image82.png	тяжесть, Сизиф, бремя, подъём, усталость, труд	Несёт тяжёлый камень вверх по склону
image83.png	работа, деньги, грусть, рубли, нелюбимая_работа, ноутбук	Уставшая за ноутбуком, думает о рублях
image84.jpg	идеи, телефон, онлайн, информация, лампочки	Девушка с телефоном, вокруг лампочки и иконки
image85.png	дата_рождения, нумерология, расчёт, цифры	Держит табличку с датой 26+03+2009
image86.png	натальная_карта, астрология, карта, ведическая, радость	Рядом с ведической картой, улыбается
image87.png	натальная_карта, показывает, астрология, объяснение	Держит и показывает ведическую карту
image88.png	боль_ЦА, выгорание, рутина, бессмысленность, день_сурка	Мысли: работаю на износ, день сурка, зачем живу
image89.png	портал, выбор, неизвестность, магия, сомнение	Смотрит на магический портал со звёздами
image90.png	смущение, тревога, нерешительность, волнение	Рука у лица, глаза вверх, смущена
image97.png	указывает, направление, показывает, цель, вправо	Показывает пальцем вправо, улыбается
image99.png	мечты, желания, шарики, призвание, свобода, помощь	С шариками: помогать людям, свободный график, призвание
image108.png	перекрёсток, выбор, не_знаю_куда, вопрос, пути	На перекрёстке 4 путей, вопрос над головой
image109.png	Сатурн, планета, грусть, ограничения, астрология	Грустит, смотрит на Сатурн
image117.png	день_сурка, рутина, круг, кровать, работа, будильник	Замкнутый цикл: кровать-будильник-работа
image129.jpg	диван, отдых, ТВ, телевизор, попкорн, комфорт	На диване с пультом и попкорном смотрит ТВ
image137.png	натальная_карта, непонимание, сложно, астрология, вопрос	Озадачена, смотрит на ведическую карту
image100.gif	книга, планета, астрология, обучение, gif	Анимированная иконка книги с символом планеты на обложке.
image101.gif	звёзды, рейтинг, оценка, успех, пять звёзд, gif	Пять красных звёзд — иконка высокого рейтинга.
image102.gif	трибуна, кафедра, выступление, спикер, обучение, gif	Иконка трибуны с микрофоном для выступлений спикера.
image103.gif	планета, астрология, gif	Анимированная иконка — астрологический символ.
image104.gif	планета, книга, астрология, знаки зодиака, обучение, gif	Планета с кольцом над раскрытой книгой с астрологическими символами.
image105.gif	забор, ограждение, граница, недвижимость, gif	Иконка деревянного забора из трёх секций.
image106.gif	барьер, ограждение, стоп, предупреждение, блокировка, gif	Дорожный барьер с оранжевыми полосами и красным сигнальным фонарём.
image107.gif	человек, фигура, стикмен, личность, gif	Схематичная фигура человека в полный рост.
image110.gif	батарея, энергия, низкий заряд, усталость, gif	Иконка батареи с низким уровнем заряда и молнией.
image111.gif	козерог, знак зодиака, астрология, gif	Анимированный символ знака зодиака Козерог.
image112.gif	рак, знак зодиака, астрология, gif	Анимированный символ знака зодиака Рак.
image113.gif	батарея, зарядка, энергия, электричество, подключение, gif	Иконка батареи с кабелем и вилкой для зарядки.
image114.gif	подарок, скидка, деньги, бонус, акция, gif	Подарочная коробка рядом с монетой и значком скидки.
image115.gif	батарея, заряд, энергия, половина, gif	Иконка батареи наполовину заряженной (зелёный).
image116.gif	курсор, клик, нажатие, интерфейс, действие, gif	Синяя рука-курсор с указательным пальцем и искрами клика.
image118.gif	батарея, полный заряд, энергия, gif	Полностью заряженная зелёная батарея с молнией.
image119.gif	рука, касание, тач, жест, интерфейс, gif	Жёлтая рука с указательным пальцем и волнами касания.
image12.gif	книга, планета, астрология, обучение, знания, gif	Книга с изображением планеты — учебник по астрологии.
image120.gif	курсор, клик, мышь, интерфейс, нажатие, gif	Иконка курсора мыши с лучами клика.
image121.gif	компас, навигация, направление, ориентир, gif	Плоская иконка компаса с красно-синей стрелкой.
image122.gif	стрелка, возврат, назад, движение, gif	Изогнутая стрелка влево — жест возврата или отмены.
image123.gif	скидка, процент, акция, цена, бейдж, gif	Иконка бейджа с символом процента — скидка или акция.
image124.gif	компас, навигация, стороны света, путешествие, gif	Компас-медальон на шнурке с обозначениями сторон света.
image125.gif	планета, астрология, сатурн, космос, gif	Иконка планеты с кольцом и кратерами в стиле Сатурна.
image126.gif	будильник, время, срочность, напоминание, gif	Нарисованный будильник с двумя колокольчиками и звонком.
image127.gif	барьер, ограждение, блокировка, закрыто, gif	Иконка раздвижного барьера-гармошки на двух столбах.
image128.gif	стрелки вниз, прокрутка, далее, навигация, gif	Две розовые стрелки вниз — прокрутка или продолжение.
image13.gif	деньги, доллар, купюры, финансы, доход, gif	Летящие зелёные долларовые купюры — символ финансового потока.
image130.gif	лайк, одобрение, галочка, успех, подтверждение, gif	Большой палец вверх с галочкой в круге — символ одобрения.
image131.gif	стрелка, курсор, указатель, навигация, gif	Маленькая чёрная стрелка-курсор.
image132.gif	монитор, деньги, доллар, график, доход, финансы, gif	Монитор с растущим баровым графиком и знаками доллара.
image133.gif	подарок, бонус, коробка, сюрприз, gif	Подарочная коробка с бантом в минималистичном стиле.
image134.gif	близнецы, знак зодиака, астрология, gif	Анимированный символ знака зодиака Близнецы.
image135.gif	батарея, заряд, энергия, ресурс, gif	Иконка батареи наполовину заряженной зелёным.
image136.gif	скидка, процент, ценник, распродажа, акция, gif	Ценник с символом процента — обозначение скидки.
image138.gif	деньги, доход, рост, финансы, график, доллар, gif	Растущий столбчатый график с символами доллара.
image139.gif	планеты, астрология, космос, орбита, gif	Четыре планеты в ряд, одна с красным узором.
image140.gif	подарок, бонус, сюрприз, праздник, звёзды, gif	Яркая красно-оранжевая подарочная коробка с жёлтым бантом.
image141.gif	подарок, бонус, коробка, сюрприз, gif	Белая подарочная коробка с зелёным бантом в изометрическом стиле.
image142.gif	деньги, передача, оплата, финансы, gif	Две руки передают мешок с деньгами — символ оплаты.
image143.gif	барьер, ограничение, запрет, стоп, gif	Дорожное заграждение с полосатыми планками — препятствие.
image144.gif	цель, мишень, стрела, успех, фокус, gif	Мишень с попавшей в центр стрелой — достижение цели.
image145.gif	цель, чеклист, задачи, планирование, успех, gif	Планшет с чеклистом и мишень — целеполагание и задачи.
image146.gif	навигатор, карта, маршрут, путь, GPS, gif	Навигационное устройство с картой и указателем маршрута.
image147.gif	деньги, передача, купюры, оплата, финансы, gif	Руки передают пачку долларовых купюр.
image148.gif	график, рост, линейный, статистика, аналитика, gif	Линейный график роста с точками на осях координат.
image149.gif	подарок, бонус, сюрприз, праздник, gif	Красная подарочная коробка с оранжевым бантом и лучами.
image150.gif	чеклист, документ, цель, задачи, успех, gif	Лист с галочками и мишень — выполнение задач.
image151.gif	деньги, рост, доход, стрелка вверх, финансы, gif	Купюра доллара с красной стрелкой роста.
image152.gif	подарок, коробка, бонус, gif	Жёлтая подарочная коробка с красным бантом.
image153.gif	звёзды, рейтинг, оценка, отзыв, пять звёзд, gif	Пять красных звёзд — символ высокого рейтинга.
image154.gif	монета, доллар, рост, доход, финансы, инвестиции, gif	Золотая монета с символом доллара и столбчатый график.
image155.gif	сертификат, одобрение, качество, значок, галочка, gif	Значок-медаль с галочкой — символ качества.
image156.gif	цель, деньги, обучение, успех, аналитика, маркетинг, gif	Мишень, ноутбук, деньги и процент — бизнес-цели.
image157.gif	подарок, бонус, праздник, сюрприз, успех, gif	Зелёная подарочная коробка с бантом и конфетти.
image158.gif	свиток, астрология, гороскоп, перо, солнце, gif	Свиток с символом солнца и пером — астрологический гороскоп.
image159.gif	деньги, передача, благотворительность, сердце, доллар, gif	Две руки передают пачку долларов с иконкой сердца.
image160.gif	рост, график, стрелка вверх, успех, прогресс, gif	Изометрический график роста с разноцветными стрелками вверх.
image161.gif	график, диаграмма, рост, статистика, gif	Столбчатая диаграмма с растущими показателями и стрелкой тренда.
image162.gif	знак зодиака, Лев, астрология, gif	Анимированный символ знака зодиака Лев.
image163.gif	график, рост, доход, успех, стрелка вверх, gif	Столбчатая диаграмма с оранжевой стрелкой роста вверх.
image164.gif	график, падение, убыток, спад, стрелка вниз, gif	Столбчатая диаграмма со стрелкой вниз — снижение показателей.
image165.gif	знак зодиака, Весы, астрология, gif	Анимированный символ знака зодиака Весы.
image166.gif	карта, путешествие, маршрут, приключение, gif	Карта сокровищ с пунктирным маршрутом и пальмами.
image167.gif	медаль, награда, достижение, успех, сертификат, gif	Медаль с галочкой и лентами — символ достижения.
image168.gif	ключ, доступ, секрет, открытие, gif	Ключ — символ доступа к знаниям или возможностям.
image169.gif	рост, растения, прогресс, развитие, природа, gif	Три ростка разной высоты в земле — символ роста.
image170.gif	карта, маршрут, путь, навигация, приключение, gif	Сложенная карта с пунктирным маршрутом и отметкой X.
image172.gif	деньги, пачки купюр, богатство, доллар, финансы, gif	Большая стопка пачек долларовых купюр.
image173.gif	карта, маршрут, навигация, геолокация, gif	Свёрнутая карта с двумя пин-маркерами и пунктирным маршрутом.
image174.gif	карта, геолокация, навигация, пункт назначения, gif	Схематичная карта с пин-маркером местоположения.
image175.gif	общение, диалог, люди, чат, обсуждение, gif	Двое людей с пузырём речи — общение и диалог.
image176.gif	деньги, доллар, рост, доход, финансы, gif	Символ доллара на фоне растущей стрелки — финансовый рост.
image177.gif	карта города, навигация, маршрут, путешествие, gif	Цветная складная карта города с улицами и парками.
image178.gif	медаль, качество, гарантия, рука, успех, gif	Рука держит медаль с галочкой — символ качества и гарантии.
image179.gif	медаль, награда, достижение, успех, gif	Медаль с зелёной галочкой и лентами — подтверждение достижения.
image18.gif	планета, книга, астрология, символы зодиака, обучение, gif	Планета с орбитой над раскрытой книгой с символами зодиака.
image180.gif	магнит, деньги, привлечение, финансы, доллар, gif	Рука с магнитом притягивает долларовые купюры.
image181.gif	солнце, планета, астрология, космос, свет, gif	Оранжевая светящаяся планета — символ Солнца в астрологии.
image182.gif	деньги, дождь, богатство, доллар, изобилие, gif	Множество летящих долларовых купюр — денежное изобилие.
image183.gif	карта, геолокация, навигация, маршрут, глобус, gif	Складная карта с пин-маркером и символом глобуса.
image184.gif	планета, космос, астрология, орбита, gif	Красная планета с кольцом и спутниками.
image185.gif	знак зодиака, Рыбы, астрология, gif	Анимированный символ знака зодиака Рыбы.
image186.gif	деньги, купюры, пачки, финансы, богатство, gif	Три стопки зелёных долларовых купюр в изометрии.
image187.gif	стрелка, указатель, движение, направление, gif	Красная стрелка-курсор, указывающая вправо.
image188.gif	магнит, деньги, притяжение, финансы, монета, gif	Подковообразный магнит притягивает монету с символом доллара.
image189.gif	магнит, монеты, деньги, притяжение, финансы, gif	Красный магнит притягивает золотые монеты с долларами.
image190.gif	магнит, монета, деньги, притяжение, финансы, gif	Контурный магнит с монетой-долларом сверху.
image191.gif	перевод денег, телефон, финансы, мобильный, gif	Два смартфона с монетами, летящими от одного к другому.
image192.gif	карта, навигация, геолокация, маршрут, gif	Развёрнутая карта с синим маркером геолокации.
image193.gif	планета, космос, астрология, орбита, скетч, gif	Контурный рисунок планеты с кольцом и звёздами.
image194.gif	магнит, деньги, притяжение, финансы, монеты, gif	Стилизованный магнит с зелёными монетами-долларами на концах.
image195.gif	глобус, земля, мир, география, планета, gif	Голубой глобус с белыми силуэтами континентов.
image196.gif	магнит, притяжение, минимализм, gif	Контурный чёрный магнит-подкова.
image197.gif	луна, месяц, астрология, ночь, звёзды, gif	Контурный полумесяц с кратерами и звёздами.
image198.gif	мешки денег, доллар, богатство, финансы, изобилие, gif	Множество зелёных мешков с долларами.
image199.gif	планета, космос, мультяшный, весёлый, астрология, gif	Милая мультяшная планета с кольцом и улыбкой.
image200.gif	видео, воспроизведение, повтор, кнопка, обучение, gif	Кнопка воспроизведения с круговыми стрелками повтора.
image201.gif	планета, космос, орбита, астрология, gif	Контурная планета с красным кольцом и центром.
image202.gif	стрелка, направление, движение, вправо, gif	Чёрная горизонтальная стрелка вправо.
image203.gif	деньги, купюра, крылья, финансы, рубль, gif	Банкнота с рублёвым символом и крыльями, летящая со звёздами.
image204.gif	планета, космос, скетч, синий, астрология, gif	Синяя планета с кольцом, нарисованная хаотичными линиями.
image205.gif	кошелёк, оплата, финансы, подтверждение, успех, gif	Два кошелька, один с зелёной галочкой подтверждения.
image206.gif	планета, космос, астрология, тёмно-синий, gif	Тёмно-синяя планета с горизонтальными полосами и спутниками.
image207.gif	планета, юпитер, космос, астрология, gif	Жёлто-оранжевая планета с волнистыми полосами — Юпитер.
image208.gif	планета, космос, орбита, контур, астрология, gif	Минималистичная чёрная планета с кольцом от руки.
image209.gif	рука, деньги, купюры, оплата, финансы, рубль, gif	Рука держит веер зелёных банкнот с монетой рубля.
image210.gif	барьер, запрет, ограничение, предупреждение, gif	Дорожный барьер с жёлто-чёрными полосами — ограничение.
image211.gif	деньги, рубли, монеты, купюры, финансы, богатство, gif	Зелёная купюра и золотые монеты со звёздочками — финансовый достаток.
image212.gif	деньги, рубли, купюры, монеты, финансы, поток, gif	Летящие зелёные купюры и золотые монеты — денежный поток.
